<?xml version="1.0" encoding="UTF-8" standalone="yes"?>
<alias_locations xmlns:xsi="http://www.w3.org/2001/XMLSchema-instance" xsi:noNamespaceSchemaLocation="alias_locations.xsd">
	<!-- Lower Udas Temple-->
	<alias_location name="IDTemple_Low_Furnace_01" world_id="300160000">
		<alias_pos x="529.252380" y="1297.261719" z="198" h="0"/>
		<alias_pos x="530.399963" y="1298.903198" z="198" h="0"/>
	</alias_location>
	<!-- Transidium_Annex -->
	<alias_location name="Alias_5" world_id="400030000">
		<alias_pos x="488.077454" y="561.374023" z="680.617981" h="0"/>
		<alias_pos x="557.602478" y="534.414490" z="680.617981" h="0"/>
		<alias_pos x="461.459229" y="491.717529" z="680.617981" h="0"/>
		<alias_pos x="530.657043" y="465.133209" z="680.617981" h="0"/>
	</alias_location>
</alias_locations>